{
  "environment": "production",
  "timeZone": "America/Los_Angeles",
  "displayIncrementMinutes": 30,
  "operatingHours": {
    "start": "08:00",
    "end": "18:00"
  },
  "administratorRecipients": [
    "admin@example.invalid"
  ],
  "oauthAudience": "REPLACE_WITH_GOOGLE_OAUTH_CLIENT_ID",
  "appsScriptUrl": "https://script.google.com/macros/s/REPLACE_WITH_DEPLOYMENT_ID/exec",
  "sheetId": "REPLACE_IN_PRIVATE_CONFIGURATION",
  "sheetOwnerEmail": "owner@example.invalid",
  "writeEnabled": false
}
